id,titulo,descricao,quote,autor,img_principal,img_secundaria_1,img_secundaria_2,cliente
analise_de_credito,"Análise de Crédito Inteligente: Reduzindo Riscos e Acelerando Vendas","Desenvolvemos um algoritmo de deep learning capaz de aprender com o perfil de milhares de clientes da loteadora Bairru. Essa solução inovadora identifica, em tempo real, o potencial de um cliente ser um bom ou mau pagador, proporcionando maior segurança e agilidade nas decisões de crédito. O resultado foi uma redução de 30 pontos percentuais nas vendas para maus pagadores e um aumento de 40% nos pagamentos adiantados durante o financiamento. \n A IA foi integrada em um aplicativo exclusivo Bairru, permitindo que a análise seja realizada em apenas 2 segundos. Dessa forma, o cliente recebe a aprovação ou reprovação da proposta instantaneamente, diretamente no ponto de venda, otimizando o processo de fechamento de negócios.","Tomar decisões de crédito rápidas e seguras é a chave para impulsionar o crescimento sustentável.","Equipe de Inovação da AtlasTech",static/assets/images/credit-0.jpg,static/assets/images/credit-1.jpg,static/assets/images/credit-2.jpg,Bairru
ferramentas_de_venda,Ferramentas de venda,Calculadora de parcelas e acesso ágil à tabela de preços,Venda mais em menos tempo.,Irina Martin,static/assets/images/venda-0.jpg,static/assets/images/venda-1.jpg,static/assets/images/venda-2.jpg,Bairru
gestao_de_pagamentos,Gestão de pagamentos,"""Geração,  vinculação e conciliação dos pagamentos""",Simplifique o financeiro da sua empresa.,Irina Martin,static/assets/images/pay-0.jpg,static/assets/images/pay-1.jpg,static/assets/images/pay-2.jpg,Bairru
aletheia,Alethe.ia,,,,static/assets/images/doc-0.jpg,,,Bairru
analise_automatizada_de_documentos,Analise automatizada de documentos,,,,static/assets/images/doc-0.jpg,static/assets/images/doc-1.jpg,static/assets/images/doc-2.jpg,Bairru
sun_trackers,Sun trackers,"Realizado nos dias 1° e 2 de outubro deste ano, o NASA International Space Apps Challenge (Space Apps Challenge), administrado pela NASA Earth Science Division (Divisão de Ciências da Terra), acontece anualmente. \n Considerado o maior hackthon do mundo, a proposta do desafio é resolver problemas do mundo real na Terra e no espaço, com os dados gratuitos e abertos das 12 Agências Espaciais parcerias, incluindo dados do Programa Espacial Brasileiro (PEB). Com eles, as equipes aprendem a usar esses recursos para resolver os desafios de cada ano. \n O Evento foi realizado em 38 cidades brasileiras, de forma presencial e online, para atender as cinco regiões do Brasil. A Agência Espacial Brasileira (AEB) apoiou o evento disponibilizando bases de dados, mentores, jurados, divulgação e apoiadores. \n Dentre as equipes brasileiras, quatro se destacaram e receberam menção honrosa do desafio. Veja quem são:  \n Equipe Sun Trackers \n Localidade: Curitiba e Região Metropolitana/PR \n Organizador do evento local: Mustafa Jean Muksen  \n Organizador do evento local: Mustafa Jean Muksen \n Qual foi o projeto desenvolvido: The Sun Tracker: um modelo de aprendizado de máquina que prevê eventos do tipo Carrington usando DSCOVR e WIND \n Em qual desafio o projeto se encaixa: Save the Earth from Another Carrington Event!",fonte: https://www.gov.br/aeb/pt-br/assuntos/noticias/equipes-brasileiras-recebem-mencao-honrosa-no-nasa-space-apps,,static/assets/images/nasa-0.jpg,static/assets/images/nasa-1.jpg,static/assets/images/nasa-2.jpg,NASA
